<?xml version="1.0" encoding="UTF-8"?>
<exception id="ErrorDeleteLogMessagesFailed" xmlns="http://bsi.bund.de/TR03151" xmlns:xsi="http://www.w3.org/2001/XMLSchema-instance" xsi:schemaLocation="http://bsi.bund.de/TR03151 ../../schema/exceptions.xsd">
    <name>ErrorDeleteLogMessagesFailed</name>
    <description>This exception is thrown if the deletion of log messages from the storage failed.</description>
    <category>Logging</category>
    <severity>High</severity>
    <javadoc>
        <summary>This class defines the exception ErrorDeleteLogMessagesFailed that is thrown if the deletion of log messages from the storage failed.</summary>
    </javadoc>
    <specification>
        <source>BSI TR-03151-1</source>
        <requirement>SHALL be raised when log message deletion operation fails</requirement>
        <applicability>Log message deletion operations</applicability>
    </specification>
    <thrownBy>
        <function>deleteLogMessages</function>
    </thrownBy>
</exception>
