<?xml version="1.0" encoding="UTF-8"?>
<exception id="ErrorTransactionCounterExhausted" xmlns="http://bsi.bund.de/TR03151" xmlns:xsi="http://www.w3.org/2001/XMLSchema-instance" xsi:schemaLocation="http://bsi.bund.de/TR03151 ../../schema/exceptions.xsd">
    <name>ErrorTransactionCounterExhausted</name>
    <description>This exception is thrown if the physical memory of the transaction counter can no longer guarantee error-free operation of the transaction counter.</description>
    <category>Transaction</category>
    <severity>Critical</severity>
    <javadoc>
        <summary>This class defines the exception ErrorTransactionCounterExhausted that is thrown if the physical memory of the transaction counter can no longer guarantee error-free operation of the transaction counter.</summary>
    </javadoc>
    <specification>
        <source>BSI TR-03151-1</source>
        <requirement>SHALL be raised when transaction counter physical memory is exhausted</requirement>
        <applicability>All transaction operations when counter exhausted</applicability>
    </specification>
    <thrownBy>
        <function>startTransaction</function>
        <function>updateTransaction</function>
        <function>finishTransaction</function>
    </thrownBy>
</exception>
