<?xml version="1.0" encoding="UTF-8"?>
<exception id="ErrorUpdateTimeFailed" xmlns="http://bsi.bund.de/TR03151" xmlns:xsi="http://www.w3.org/2001/XMLSchema-instance" xsi:schemaLocation="http://bsi.bund.de/TR03151 ../../schema/exceptions.xsd">
    <name>ErrorUpdateTimeFailed</name>
    <description>This exception is thrown if the execution of the Secure Element functionality for setting the time failed.</description>
    <category>Time Synchronization</category>
    <severity>High</severity>
    <javadoc>
        <summary>This class defines the exception ErrorUpdateTimeFailed that is thrown if the execution of the Secure Element functionality for setting the time failed.</summary>
    </javadoc>
    <specification>
        <source>BSI TR-03151-1</source>
        <requirement>SHALL be raised when time update operation in Secure Element fails</requirement>
        <applicability>Time synchronization operations</applicability>
    </specification>
    <thrownBy>
        <function>updateTime</function>
    </thrownBy>
</exception>
