<?xml version="1.0" encoding="UTF-8"?>
<exception id="ErrorGetSupportedUpdateVariantsFailed" xmlns="http://bsi.bund.de/TR03151" xmlns:xsi="http://www.w3.org/2001/XMLSchema-instance" xsi:schemaLocation="http://bsi.bund.de/TR03151 ../../schema/exceptions.xsd">
    <name>ErrorGetSupportedUpdateVariantsFailed</name>
    <description>This exception is thrown if the identification of the supported variant(s) for updating transactions failed.</description>
    <category>Transaction</category>
    <severity>Medium</severity>
    <javadoc>
        <summary>This class defines the exception ErrorGetSupportedUpdateVariantsFailed that is thrown if the identification of the supported variant(s) for updating transactions failed.</summary>
    </javadoc>
    <specification>
        <source>BSI TR-03151-1</source>
        <requirement>SHALL be raised when supported update variant query fails</requirement>
        <applicability>Transaction update variant query operations</applicability>
    </specification>
    <thrownBy>
        <function>getSupportedTransactionUpdateVariants</function>
    </thrownBy>
</exception>
