<?xml version="1.0" encoding="UTF-8"?>
<exception id="ErrorRegisterClientFailed" xmlns="http://bsi.bund.de/TR03151" xmlns:xsi="http://www.w3.org/2001/XMLSchema-instance" xsi:schemaLocation="http://bsi.bund.de/TR03151 ../../schema/exceptions.xsd">
    <name>ErrorRegisterClientFailed</name>
    <description>This exception is thrown if the registration of a client failed.</description>
    <category>Client Management</category>
    <severity>High</severity>
    <javadoc>
        <summary>This class defines the exception ErrorRegisterClientFailed that is thrown if the registration of a client failed.</summary>
    </javadoc>
    <specification>
        <source>BSI TR-03151-1</source>
        <requirement>SHALL be raised when client registration operation fails</requirement>
        <applicability>Client registration operations</applicability>
    </specification>
    <thrownBy>
        <function>registerClient</function>
    </thrownBy>
</exception>
